{
  "_note": "Тексты экрана «Premium» 💎. Пункты шторок: ref указывает на то, что есть в контенте (game+deck, game+extras, test-depth, locked-tests). Если ref не найден в контенте или ref нет — статус «скоро». Слово VIP в интерфейсе не используем.",
  "tile": {
    "title": "Premium",
    "subtitle": "без ограничений"
  },
  "header": "Premium",
  "badge": "GAZ Premium",
  "title": "Без ограничений",
  "lead": "Всё, что под 💎, открывается. Глубже тесты, острее колоды, новое раньше всех.",
  "sections": [
    {
      "id": "pairs",
      "emoji": "💞",
      "title": "Для пар",
      "line": "Бездна, Жарче, Совместимость",
      "items": [
        {
          "label": "Насколько знаешь: Бездна",
          "ref": {
            "game": "know-each-other",
            "deck": "abyss"
          }
        },
        {
          "label": "Совпадём?: Глубоко",
          "ref": {
            "game": "match-us",
            "deck": "deep"
          }
        },
        {
          "label": "Правда или действие: Жарче",
          "ref": {
            "game": "truth-or-dare"
          }
        },
        {
          "label": "Совместимость пары",
          "ref": {
            "compat": "attachment-style"
          }
        },
        {
          "label": "36 вопросов"
        }
      ]
    },
    {
      "id": "company",
      "emoji": "🎉",
      "title": "Для компании",
      "line": "Без тормозов, Жёстко, роли Мафии",
      "items": [
        {
          "label": "Кто из нас?: Без тормозов",
          "ref": {
            "game": "who-of-us",
            "deck": "no-brakes"
          }
        },
        {
          "label": "Я никогда не…: Без тормозов",
          "ref": {
            "game": "never-have-i-ever",
            "deck": "no-brakes"
          }
        },
        {
          "label": "Правда или действие: Жёстко",
          "ref": {
            "game": "truth-or-dare"
          }
        },
        {
          "label": "Мафия: роли и темы",
          "ref": {
            "game": "mafia",
            "extras": true
          }
        },
        {
          "label": "Шпион: Кино, Сериалы, Знаменитости"
        }
      ]
    },
    {
      "id": "solo",
      "emoji": "🧠",
      "title": "Познай себя",
      "line": "Глубина в каждом тесте, Пазл личности",
      "items": [
        {
          "label": "Глубина в каждом тесте",
          "ref": {
            "lockedTests": true
          }
        },
        {
          "label": "Пазл личности"
        },
        {
          "label": "Новые тесты раньше всех",
          "ref": {
            "always": true
          }
        }
      ]
    }
  ],
  "soon": "скоро",
  "sheetClose": "Понятно",
  "fresh": {
    "emoji": "🆕",
    "text": "Новые вопросы каждую неделю.",
    "accent": "В Premium раньше всех."
  },
  "cta": "Оформить Premium 💎",
  "paySheet": {
    "title": "Оплата откроется на запуске 💎",
    "text": "Мы ещё в тестовой версии. Жми «Хочу первым», и на старте дадим скидку.",
    "button": "Хочу первым 🔔",
    "done": "Записали 🔔 На старте напомним и дадим скидку"
  },
  "code": {
    "link": "Есть код? 🔑",
    "title": "Ввести код 🔑",
    "placeholder": "Код",
    "button": "Активировать",
    "cancel": "Отмена",
    "wrong": "Не тот код, проверь ещё раз"
  },
  "fine": "Тестовая версия: деньги не списываются",
  "on": {
    "title": "Premium включён",
    "lead": "Ограничений больше нет. Новое будет приходить сюда первым.",
    "tileState": "Открыто ✓",
    "cta": "Пробовать закрытое 💎",
    "fine": "Доступ фокус-группы"
  },
  "preview": {
    "why": "Зачем этот тест",
    "learn": "Что узнаешь",
    "example": "Пример вопроса",
    "unlock": "Открыть с Premium 💎",
    "close": "Не сейчас"
  }
}